<?xml encoding="UTF-8"?>

<!ELEMENT information (act)*>

<!ELEMENT act (sc)+>
<!ATTLIST act nom CDATA #REQUIRED>

<!ELEMENT sc EMPTY>
<!ATTLIST sc
  nom CDATA #REQUIRED
  sort (adopté|rejeté) #REQUIRED date CDATA #REQUIRED
  mandat CDATA #REQUIRED grp CDATA #REQUIRED
  présent (Oui|Nom) #REQUIRED>